{
  "version": 1,
  "html": "<p style=\"font-size: 1.1em; line-height: 1.6; margin-bottom: 24px;\">\n<strong>Honest take:</strong> None of these products are knives, and none of them will help you cut a banana. This appears to be a mismatched product selection that includes a Christmas tree storage bag, a water bottle, and bed sheets. For cutting bananas, you'd want a simple paring knife or a basic kitchen knife‚Äînone of which are listed here.\n</p>\n\n<div style=\"background-color: #f8f9fa; border: 1px solid #e5e7eb; border-radius: 8px; padding: 20px; margin-bottom: 20px;\">\n<h3 style=\"margin-top: 0;\" data-asin=\"B01KKNFTPC\">ZOBER 9 Ft Large Christmas Tree Storage Bag</h3>\n<p>This is a storage bag for artificial Christmas trees‚Äîdefinitely not a knife or anything banana-related.</p>\n<p><strong>Best for:</strong> Storing your Christmas tree in the off-season</p>\n<p style=\"color: #666;\"><strong>Watch out:</strong> Will not cut anything, including bananas</p>\n</div>\n\n<div style=\"background-color: #f8f9fa; border: 1px solid #e5e7eb; border-radius: 8px; padding: 20px; margin-bottom: 20px;\">\n<h3 style=\"margin-top: 0;\" data-asin=\"B0CL5P6P4H\">Owala FreeSip Insulated Water Bottle</h3>\n<p>A popular insulated water bottle with a built-in straw‚Äîgreat for hydration, useless for cutting fruit.</p>\n<p><strong>Best for:</strong> Keeping drinks cold while you're on the go</p>\n<p style=\"color: #666;\"><strong>Watch out:</strong> Zero cutting capability whatsoever</p>\n</div>\n\n<div style=\"background-color: #f8f9fa; border: 1px solid #e5e7eb; border-radius: 8px; padding: 20px; margin-bottom: 20px;\">\n<h3 style=\"margin-top: 0;\" data-asin=\"B08R9G9L2B\">Queen Size 4 Piece Sheet Set</h3>\n<p>Soft, affordable bed sheets that are well-reviewed‚Äîbut they're fabric, not cutlery.</p>\n<p><strong>Best for:</strong> Getting a good night's sleep</p>\n<p style=\"color: #666;\"><strong>Watch out:</strong> Attempting to cut a banana with sheets will just make a mess</p>\n</div>\n\n<div style=\"background-color: #fff3cd; border: 1px solid #ffc107; border-radius: 8px; padding: 20px; margin-top: 24px;\">\n<strong>üçå What You Actually Need:</strong> For cutting bananas, look for a basic paring knife ($8-15), a serrated utility knife, or even a butter knife works fine since bananas are so soft. Search for \"paring knife\" or \"fruit knife\" in Home & Kitchen to find appropriate options.\n</div>",
  "products": [
    {
      "asin": "B01KKNFTPC",
      "title": "ZOBER 9 Ft Large Christmas Tree Storage Bag - Fits 9 Ft Artificial Trees - Plastic, Waterproof Christmas Tree Bag For Storage Box For Xmas - Strong, Durable Handles - Label Card Slot - Red",
      "price": "$9.99",
      "rating": 4.5,
      "reviewCount": 84955,
      "imageUrl": "https://images-na.ssl-images-amazon.com/images/I/81om0NhnyEL._AC_UL600_SR600,400_.jpg",
      "affiliateUrl": "https://www.amazon.com/dp/B01KKNFTPC?tag=veguitas-20",
      "rank": 1,
      "selected": true
    },
    {
      "asin": "B0BZYCJK89",
      "title": "Owala FreeSip Insulated Stainless Steel Water Bottle with Straw, BPA-Free Sports Water Bottle, Great for Travel, 24 Oz, Denim",
      "price": "$29.99",
      "rating": 4.7,
      "reviewCount": 103809,
      "imageUrl": "https://images-na.ssl-images-amazon.com/images/I/61sS-XIvEXL._AC_UL600_SR600,400_.jpg",
      "affiliateUrl": "https://www.amazon.com/dp/B0BZYCJK89?tag=veguitas-20",
      "rank": 2,
      "selected": true
    },
    {
      "asin": "B01M16WBW1",
      "title": "Queen Size 4 Piece Sheet Set - Comfy Breathable & Cooling Bed Sheets Set - Hotel Luxury Bedding for Women, Men, Kids, Teens, Boys & Girls - Deep Pockets, Ultra-Soft, Wrinkle Free - Oeko-Tex - White",
      "price": "$24.99",
      "rating": 4.5,
      "reviewCount": 419483,
      "imageUrl": "https://images-na.ssl-images-amazon.com/images/I/61pOaiLFYPL._AC_UL300_SR300,200_.jpg",
      "affiliateUrl": "https://www.amazon.com/dp/B01M16WBW1?tag=veguitas-20",
      "rank": 3,
      "selected": true
    }
  ],
  "prompt": "Generated via admin UI",
  "model": "claude-opus-4-5-20251101",
  "createdAt": "2026-01-09T20:37:16.808Z"
}