{
  "$schema": "../../schemas/version.schema.json",
  "version": 1,
  "html": "<article><h1>Best Phone Chargers 2024</h1><p>Looking for reliable phone chargers to send to family? We've curated the best options that combine quality, affordability, and durability.</p><section><h2>1. Anker PowerPort III</h2><p>The gold standard in charging technology. Fast, reliable, and built to last.</p></section><section><h2>2. Samsung 25W Super Fast Charger</h2><p>Perfect for Samsung devices, but works great with any USB-C phone.</p></section></article>",
  "products": [
    {
      "asin": "B07WRKXQ8W",
      "title": "Anker PowerPort III Nano 20W",
      "price": "$15.99",
      "rating": 4.7,
      "reviewCount": 45230,
      "imageUrl": "https://m.media-amazon.com/images/I/51Gs4Lf2SpL._AC_SL1500_.jpg",
      "affiliateUrl": "https://www.amazon.com/dp/B07WRKXQ8W?tag=veguitas-20",
      "rank": 1,
      "badge": "Best Seller",
      "pros": ["Compact size", "Fast charging", "Reliable brand"],
      "cons": ["No cable included"]
    },
    {
      "asin": "B08PFWLH96",
      "title": "Samsung 25W Super Fast Charger",
      "price": "$19.99",
      "rating": 4.6,
      "reviewCount": 28450,
      "imageUrl": "https://m.media-amazon.com/images/I/51RvLqFFwnL._AC_SL1500_.jpg",
      "affiliateUrl": "https://www.amazon.com/dp/B08PFWLH96?tag=veguitas-20",
      "rank": 2,
      "pros": ["Official Samsung product", "Super fast charging"],
      "cons": ["Only USB-C output"]
    }
  ],
  "prompt": "Create engaging content about the best phone chargers for 2024, focusing on value and reliability.",
  "model": "claude-3-sonnet-20240229",
  "createdAt": "2024-01-02T00:00:00.000Z"
}
